{
  "$schema": "../../../../schemas/battle-effect.schema.json",
  "id": "fx_hit_none",
  "label": "無属性ヒット",
  "timing": "onHit",
  "durationMs": 240,
  "target": "target",
  "visual": {
    "kind": "flash",
    "color": "var(--battle-element-none)",
    "shake": 0.4
  },
  "sfx": "battle_hit_none"
}
