{
  "$schema": "../../../../schemas/battle-effect.schema.json",
  "id": "fx_hit_magical",
  "label": "魔法ヒット",
  "timing": "onHit",
  "durationMs": 260,
  "target": "target",
  "visual": {
    "kind": "burst",
    "color": "var(--battle-element-magical)",
    "shake": 0.45
  },
  "sfx": "battle_hit_magical"
}
